ts_code,name,area,fullname,enname,cnspell,market,list_date
300919.SZ,中伟股份,贵州,中伟新材料股份有限公司,"Cngr Advanced Material Co.,Ltd.",zwgf,创业板,20201223
300920.SZ,润阳科技,浙江,浙江润阳新材料科技股份有限公司,"Zhejiang Runyang New Material Technology Co.,Ltd.",rykj,创业板,20201225
300921.SZ,南凌科技,深圳,南凌科技股份有限公司,NOVA Technology Corporation Limited,nlkj,创业板,20201222
300922.SZ,天秦装备,河北,秦皇岛天秦装备制造股份有限公司,"Qinhuangdao Tianqin Equipment Manufacturing Co.,Ltd.",tqzb,创业板,20201225
300923.SZ,研奥股份,吉林,研奥电气股份有限公司,"Yeal Electric Co., Ltd",yagf,创业板,20201224
300925.SZ,法本信息,深圳,深圳市法本信息技术股份有限公司,"Shenzhen Farben Information Technology Co.,Ltd.",fbxx,创业板,20201230
300926.SZ,博俊科技,江苏,江苏博俊工业科技股份有限公司,"Jiangsu Bojun Industrial Technology Co.,Ltd",bjkj,创业板,20210107
300927.SZ,江天化学,江苏,南通江天化学股份有限公司,"Nantong Jiangtian Chemical Co., Ltd.",jthx,创业板,20210107
300928.SZ,华安鑫创,北京,华安鑫创控股(北京)股份有限公司,"Haxc Holdings (Beijing) Co., Ltd.",haxc,创业板,20210106
300929.SZ,华骐环保,安徽,安徽华骐环保科技股份有限公司,"Anhui Huaqi Environmental Protection&Technology Co.,Ltd.",hqhb,创业板,20210120
300930.SZ,屹通新材,浙江,杭州屹通新材料股份有限公司,"Hang Zhou Yitong New Materials Co.,Ltd.",ytxc,创业板,20210121
300931.SZ,通用电梯,江苏,通用电梯股份有限公司,"General Elevator Co., Ltd.",tydt,创业板,20210121
300932.SZ,三友联众,广东,三友联众集团股份有限公司,Sanyou Corporation Limited,sylz,创业板,20210122
300933.SZ,中辰股份,江苏,中辰电缆股份有限公司,"Sinostar Cable Co., Ltd.",zcgf,创业板,20210122
300935.SZ,盈建科,北京,北京盈建科软件股份有限公司,"Beijing Yjk Building Software Co.,Ltd.",yjk,创业板,20210120
300936.SZ,中英科技,江苏,常州中英科技股份有限公司,"Changzhou Zhongying Science & Technology Co., Ltd.",zykj,创业板,20210126
300937.SZ,药易购,四川,四川合纵药易购医药股份有限公司,"Sichuan Hezong Medicine Co., Ltd.",yyg,创业板,20210127
300938.SZ,信测标准,深圳,深圳信测标准技术服务股份有限公司,"EMTEK(Shenzhen)Co., Ltd.",xcbz,创业板,20210127
300939.SZ,秋田微,深圳,深圳秋田微电子股份有限公司,"Shenzhen AV-Display Co., Ltd.",qtw,创业板,20210128
300940.SZ,南极光,深圳,深圳市南极光电子科技股份有限公司,"Shen Zhen Australis Electronic Technology Co.,Ltd.",njg,创业板,20210203
300941.SZ,创识科技,福建,福建创识科技股份有限公司,"Chase Science Co.,Ltd",cskj,创业板,20210209
300942.SZ,易瑞生物,深圳,深圳市易瑞生物技术股份有限公司,"Shenzhen Bioeasy Biotechnology Co.,Ltd.",yrsw,创业板,20210209
300943.SZ,春晖智控,浙江,浙江春晖智能控制股份有限公司,"Zhejiang Chunhui Intelligent Control Co., Ltd.",chzk,创业板,20210210
300945.SZ,曼卡龙,浙江,曼卡龙珠宝股份有限公司,"Mclon Jewellery Co.,Ltd.",mkl,创业板,20210210
300946.SZ,恒而达,福建,福建恒而达新材料股份有限公司,"Hengda New Materials (Fujian) Co.,Ltd",hed,创业板,20210208
300947.SZ,德必集团,上海,上海德必文化创意产业发展(集团)股份有限公司,Shanghai Dobe Cultural&Creative Industry Development (Group) Co. Ltd.,dbjt,创业板,20210210
300948.SZ,冠中生态,山东,青岛冠中生态股份有限公司,"Qingdao Greensum Ecology Co.,Ltd.",gzst,创业板,20210225
300949.SZ,奥雅设计,深圳,深圳奥雅设计股份有限公司,Shenzhen L&A Design Holding Limited,aysj,创业板,20210226
300950.SZ,德固特,山东,青岛德固特节能装备股份有限公司,"Doright Co.,Ltd.",dgt,创业板,20210303
300951.SZ,博硕科技,深圳,深圳市博硕科技股份有限公司,"Shenzhen Bsc Technology Co.,Ltd.",bskj,创业板,20210226
300952.SZ,恒辉安防,江苏,江苏恒辉安防股份有限公司,"Jiangsu Hanvo Safety Product Co., Ltd.",hhaf,创业板,20210311
300953.SZ,震裕科技,浙江,宁波震裕科技股份有限公司,"Ningbo Zhenyu Technology Co., Ltd.",zykj,创业板,20210318
300955.SZ,嘉亨家化,福建,嘉亨家化股份有限公司,"Jahen Household Products Co.,Ltd.",jhjh,创业板,20210324
300956.SZ,英力股份,安徽,安徽英力电子科技股份有限公司,Anhui Shiny Electronic Technology Company Limited,ylgf,创业板,20210326
300957.SZ,贝泰妮,云南,云南贝泰妮生物科技集团股份有限公司,Yunnan Botanee Bio-Technology Group Co. LTD,btn,创业板,20210325
300958.SZ,建工修复,北京,北京建工环境修复股份有限公司,"Bceg Environmental Remediation Co., Ltd.",jgxf,创业板,20210329
300959.SZ,线上线下,江苏,无锡线上线下通讯信息技术股份有限公司,"Wuxi Online Offline Communication Information Technology Co., Ltd.",xsxx,创业板,20210322
300960.SZ,通业科技,深圳,深圳通业科技股份有限公司,"Shenzhen Tongye Technology Co.,Ltd.",tykj,创业板,20210329
300961.SZ,深水海纳,深圳,深水海纳水务集团股份有限公司,"Hynar Water Group Co., Ltd.",sshn,创业板,20210330
300962.SZ,中金辐照,深圳,中金辐照股份有限公司,Zhongjin Irradiation Incorporated Company,zjfz,创业板,20210409
300963.SZ,中洲特材,上海,上海中洲特种合金材料股份有限公司,"Shanghai Zhongzhou Special Alloy Materials Co., Ltd.",zztc,创业板,20210409
300964.SZ,本川智能,江苏,江苏本川智能电路科技股份有限公司,"Jiangsu Allfavor Intelligent Circuits Technology Co., Ltd.",bczn,创业板,20210805
300965.SZ,恒宇信通,北京,恒宇信通航空装备(北京)股份有限公司,"Beijing Hengyu Datacom Aviation Equipment Co., Ltd",hyxt,创业板,20210402
300966.SZ,共同药业,湖北,湖北共同药业股份有限公司,"Hubei Goto Biopharm Co.,Ltd.",gtyy,创业板,20210409
300967.SZ,晓鸣股份,宁夏,宁夏晓鸣农牧股份有限公司,"Ningxia Xiaoming Agriculture & Animal Husbandry Co., Ltd.",xmgf,创业板,20210413
300968.SZ,格林精密,广东,广东格林精密部件股份有限公司,"Guangdong Green Precision Components Co., Ltd.",gljm,创业板,20210415
300969.SZ,恒帅股份,浙江,宁波恒帅股份有限公司,"NINGBO HENGSHUAI Co., LTD.",hsgf,创业板,20210412
300970.SZ,华绿生物,江苏,江苏华绿生物科技股份有限公司,"Jiangsu Hualv Biological Technology Co.,Ltd",hlsw,创业板,20210412
300971.SZ,博亚精工,湖北,襄阳博亚精工装备股份有限公司,"Xiangyang BOYA Precision Industrial Equipments Co., Ltd.",byjg,创业板,20210415
300972.SZ,万辰生物,福建,福建万辰生物科技股份有限公司,"Fujian Wanchen Biotechnology Co., Ltd.",wcsw,创业板,20210419
300973.SZ,立高食品,广东,立高食品股份有限公司,"Ligao Foods Co.,Ltd",lgsp,创业板,20210415
300975.SZ,商络电子,江苏,南京商络电子股份有限公司,Nanjing Sunlord Electronics Corporation Ltd.,sldz,创业板,20210421
300976.SZ,达瑞电子,广东,东莞市达瑞电子股份有限公司,"Dongguan Tarry Electronics Co.,Ltd.",drdz,创业板,20210419
300977.SZ,深圳瑞捷,深圳,深圳瑞捷工程咨询股份有限公司,"Shenzhen Ridge Engineering Consulting Co., Ltd.",szrj,创业板,20210420
300978.SZ,东箭科技,广东,广东东箭汽车科技股份有限公司,"WINBO-Dongjian Automotive Technology Co., Ltd.",djkj,创业板,20210426
300979.SZ,华利集团,广东,中山华利实业集团股份有限公司,Huali Industrial Group Company Limited,hljt,创业板,20210426
300980.SZ,祥源新材,湖北,湖北祥源新材科技股份有限公司,Hubei Xiangyuan New Material Technology Inc.,xyxc,创业板,20210421
300981.SZ,中红医疗,河北,中红普林医疗用品股份有限公司,"Zhonghong Pulin Medical Products Co., Ltd.",zhyl,创业板,20210427
300982.SZ,苏文电能,江苏,苏文电能科技股份有限公司,"Suwen Electric Energy Technology Co.,Ltd.",swdn,创业板,20210427
300983.SZ,尤安设计,上海,上海尤安建筑设计股份有限公司,"Shanghai Urban Architecture Design Co.,Ltd.",yasj,创业板,20210420
300984.SZ,金沃股份,浙江,浙江金沃精工股份有限公司,"Zhejiang JW Precision Machinery Co.,Ltd.",jwgf,创业板,20210618
300985.SZ,致远新能,吉林,长春致远新能源装备股份有限公司,"Changchun Zhiyuan New Energy Equipment Co.,Ltd.",zyxn,创业板,20210429
300986.SZ,志特新材,江西,江西志特新材料股份有限公司,Jiangxi Geto New Materials Corporation Limited,ztxc,创业板,20210430
300987.SZ,川网传媒,四川,四川新闻网传媒(集团)股份有限公司,"Sichuan Newsnet Media (Group) Co.,Ltd",cwcm,创业板,20210511
300988.SZ,津荣天宇,天津,天津津荣天宇精密机械股份有限公司,"Tianjin Jinrong Tianyu Precision Machinery Co., Ltd.",jrty,创业板,20210512
300989.SZ,蕾奥规划,深圳,深圳市蕾奥规划设计咨询股份有限公司,"Lay-Out Planning Consultants Co., Ltd.",lagh,创业板,20210507
300990.SZ,同飞股份,河北,三河同飞制冷股份有限公司,"Sanhe Tongfei Refrigeration Co.,Ltd.",tfgf,创业板,20210512
300991.SZ,创益通,深圳,深圳市创益通技术股份有限公司,"Shenzhen Chuangyitong Technology Co.,Ltd.",cyt,创业板,20210520
300992.SZ,泰福泵业,浙江,浙江泰福泵业股份有限公司,"Zhejiang Taifu Pump Co., Ltd",tfby,创业板,20210525
300993.SZ,玉马遮阳,山东,山东玉马遮阳科技股份有限公司,"Shandong Yuma Sun-Shading Technology Corp., Ltd.",ymzy,创业板,20210524
300994.SZ,久祺股份,浙江,久祺股份有限公司,Joy Kie Corporation Limited.,jqgf,创业板,20210812
300995.SZ,奇德新材,广东,广东奇德新材料股份有限公司,"Guangdong Kitech New Material Holding Co.,Ltd.",qdxc,创业板,20210526
300996.SZ,普联软件,山东,普联软件股份有限公司,Pansoft Company Limited,plrj,创业板,20210603
300997.SZ,欢乐家,广东,欢乐家食品集团股份有限公司,"Huanlejia Food Group Co., Ltd.",hlj,创业板,20210602
300998.SZ,宁波方正,浙江,宁波方正汽车模具股份有限公司,"Ningbo Fangzheng Automobile Mould Co., Ltd.",nbfz,创业板,20210602
300999.SZ,金龙鱼,上海,益海嘉里金龙鱼粮油食品股份有限公司,"Yihai Kerry Arawana Holdings Co.,Ltd",jly,创业板,20201015
301000.SZ,肇民科技,上海,上海肇民新材料科技股份有限公司,"Shanghai Hajime Advanced Material Technology Co., Ltd",zmkj,创业板,20210528
301001.SZ,凯淳股份,上海,上海凯淳实业股份有限公司,"Shanghai Kaytune Industrial Co., Ltd.",kcgf,创业板,20210528
301002.SZ,崧盛股份,深圳,深圳市崧盛电子股份有限公司,"Shenzhen Sosen Electronics Co., Ltd",ssgf,创业板,20210607
301003.SZ,江苏博云,江苏,江苏博云塑业股份有限公司,"Jiangsu Boiln Plastics Co., Ltd.",jsby,创业板,20210601
301004.SZ,嘉益股份,浙江,浙江嘉益保温科技股份有限公司,"Zhejiang Cayi Vacuum Container Co., Ltd.",jygf,创业板,20210625
301005.SZ,超捷股份,上海,超捷紧固系统(上海)股份有限公司,"Essence Fastening Systems (Shanghai) Co., Ltd.",cjgf,创业板,20210601
301006.SZ,迈拓股份,江苏,迈拓仪表股份有限公司,"Meter Instruments Co., Ltd",mtgf,创业板,20210607
301007.SZ,德迈仕,辽宁,大连德迈仕精密科技股份有限公司,"Dalian Demaishi Precision Technology Co.,Ltd.",dms,创业板,20210616
301008.SZ,宏昌科技,浙江,浙江宏昌电器科技股份有限公司,"Zhejiang Hongchang Electrical Technology Co., Ltd.",hckj,创业板,20210611
301009.SZ,可靠股份,浙江,杭州可靠护理用品股份有限公司,"Hangzhou Coco Healthcare Products Co., Ltd.",kkgf,创业板,20210617
301010.SZ,晶雪节能,江苏,江苏晶雪节能科技股份有限公司,"Jiangsu Jingxue Insulation Technology Co.,Ltd.",jxjn,创业板,20210618
301011.SZ,华立科技,广东,广州华立科技股份有限公司,Guangzhou Wahlap Technology Corporation Limited,hlkj,创业板,20210617
301012.SZ,扬电科技,江苏,江苏扬电科技股份有限公司,Jiangsu Yangdian Science&Technology Co. Ltd.,ydkj,创业板,20210622
301013.SZ,利和兴,深圳,深圳市利和兴股份有限公司,"Shenzhen Lihexing Co., Ltd",lhx,创业板,20210629
301015.SZ,百洋医药,山东,青岛百洋医药股份有限公司,Qingdao Baheal Medical Inc.,byyy,创业板,20210630
301016.SZ,雷尔伟,江苏,南京雷尔伟新技术股份有限公司,"Nanjing Railway New Technology Co.,Ltd.",lew,创业板,20210630
301017.SZ,漱玉平民,山东,漱玉平民大药房连锁股份有限公司,"Shu Yu Civilian Pharmacy Corp.,Ltd.",sypm,创业板,20210705
301018.SZ,申菱环境,广东,广东申菱环境系统股份有限公司,"Guangdong Shenling Environmental Systems Co., Ltd.",slhj,创业板,20210707
301019.SZ,宁波色母,浙江,宁波色母粒股份有限公司,"Ningbo Color Master Batch Co., Ltd.",nbsm,创业板,20210628
301020.SZ,密封科技,山东,烟台石川密封科技股份有限公司,"Yantai Ishikawa Sealing Technology Co.,Ltd.",mfkj,创业板,20210706
301021.SZ,英诺激光,深圳,英诺激光科技股份有限公司,"Inno Laser Technology Co., Ltd.",ynjg,创业板,20210706
301022.SZ,海泰科,山东,青岛海泰科模塑科技股份有限公司,"Qingdao Hi-Tech Moulds&Plastics Technology Co., Ltd.",htk,创业板,20210702
301023.SZ,江南奕帆,江苏,无锡江南奕帆电力传动科技股份有限公司,"Jiangnan Yifan Motor Co.,Ltd",jnyf,创业板,20210707
301024.SZ,霍普股份,上海,上海霍普建筑设计事务所股份有限公司,"Shanghai Hyp-Arch Architectural Design Consultant Co.,Ltd.",hpgf,创业板,20210728
301025.SZ,读客文化,上海,读客文化股份有限公司,Dook Media Group Limited,dkwh,创业板,20210719
301026.SZ,浩通科技,江苏,徐州浩通新材料科技股份有限公司,Hootech Inc.,htkj,创业板,20210716
301027.SZ,华蓝集团,广西,华蓝集团股份公司,"Hualan Group Co., Ltd.",hljt,创业板,20210715
301028.SZ,东亚机械,福建,厦门东亚机械工业股份有限公司,"Xiamen East Asia Machinery Industrial Co., Ltd.",dyjx,创业板,20210720
301029.SZ,怡合达,广东,东莞怡合达自动化股份有限公司,"Dongguan Yiheda Automation Co., Ltd.",yhd,创业板,20210723
301030.SZ,仕净科技,江苏,苏州仕净科技股份有限公司,"Suzhou Shijing Environmental Technology Co.,Ltd",sjkj,创业板,20210722
301031.SZ,中熔电气,陕西,西安中熔电气股份有限公司,"Xi'an Sinofuse Electric Co., Ltd.",zrdq,创业板,20210715
301032.SZ,新柴股份,浙江,浙江新柴股份有限公司,"Zhejiang Xinchai Co.,Ltd",xcgf,创业板,20210722
301033.SZ,迈普医学,广东,广州迈普再生医学科技股份有限公司,"Medprin Regenerative Medical Technologies Co., Ltd.",mpyx,创业板,20210726
301035.SZ,润丰股份,山东,山东潍坊润丰化工股份有限公司,"Shandong Weifang Rainbow Chemical Co., Ltd",rfgf,创业板,20210728
301036.SZ,双乐股份,江苏,双乐颜料股份有限公司,"Sunlour Pigment Co.,Ltd.",slgf,创业板,20210729
301037.SZ,保立佳,上海,上海保立佳化工股份有限公司,"Shanghai Baolijia Chemical Co., Ltd.",blj,创业板,20210730
301038.SZ,深水规院,深圳,深圳市水务规划设计院股份有限公司,"Shenzhen Water Planning & Design Institute Co., Ltd.",ssgy,创业板,20210804
301039.SZ,中集车辆,深圳,中集车辆(集团)股份有限公司,"Cimc Vehicles (Group) Co., Ltd.",zjcl,创业板,20210708
301040.SZ,中环海陆,江苏,张家港中环海陆高端装备股份有限公司,"Zhangjiagang Zhonghuan Hailu High-End Equipment Co., Ltd.",zhhl,创业板,20210803
301041.SZ,金百泽,深圳,深圳市金百泽电子科技股份有限公司,"Shenzhen King Brother Electronics Technology Co.,Ltd.",jbz,创业板,20210811
301042.SZ,安联锐视,广东,珠海安联锐视科技股份有限公司,"Zhuhai Raysharp Technology Co.,Ltd.",alrs,创业板,20210805
301043.SZ,绿岛风,广东,广东绿岛风空气系统股份有限公司,"Guangdong Nedfon Air System Co., Ltd.",ldf,创业板,20210811
301045.SZ,天禄科技,江苏,苏州天禄光科技股份有限公司,"Talant Optronics(Suzhou)Co., Ltd.",tlkj,创业板,20210813
301046.SZ,能辉科技,上海,上海能辉科技股份有限公司,"Shanghai Nenghui Technology Co.,Ltd.",nhkj,创业板,20210817
301047.SZ,义翘神州,北京,北京义翘神州科技股份有限公司,Sino Biological Inc.,yqsz,创业板,20210816
301048.SZ,金鹰重工,湖北,金鹰重型工程机械股份有限公司,"Gemac Engineering Machinery Co., Ltd.",jyzg,创业板,20210818
301049.SZ,超越科技,安徽,安徽超越环保科技股份有限公司,"Anhui Chaoyue Environmental Protection Technology Co.,Ltd.",cykj,创业板,20210824
301050.SZ,雷电微力,四川,成都雷电微力科技股份有限公司,"Chengdu RML Technology Co., Ltd.",ldwl,创业板,20210824
301051.SZ,信濠光电,深圳,深圳市信濠光电科技股份有限公司,"Shenzhen Xinhao Photoelectricity Technology Co., Ltd",xhgd,创业板,20210827
301052.SZ,果麦文化,浙江,果麦文化传媒股份有限公司,"Guomai Culture&Media Co., Ltd.",gmwh,创业板,20210830
301053.SZ,远信工业,浙江,远信工业股份有限公司,"Yoantion Industrial Inc.,Ltd.",yxgy,创业板,20210901
301055.SZ,张小泉,浙江,张小泉股份有限公司,Zhang Xiaoquan Inc.,zxq,创业板,20210906
301056.SZ,森赫股份,浙江,森赫电梯股份有限公司,"Sicher Elevator Co., Ltd.",shgf,创业板,20210907
301057.SZ,汇隆新材,浙江,浙江汇隆新材料股份有限公司,"Zhejiang Huilong New Materials Co.,Ltd.",hlxc,创业板,20210909
301058.SZ,中粮工科,江苏,中粮工程科技股份有限公司,"COFCO Engineering & Technology Co., Ltd.",zlgk,创业板,20210909
301059.SZ,金三江,广东,金三江(肇庆)硅材料股份有限公司,Jinsanjiang (Zhaoqing) Silicon Material Company Limited,jsj,创业板,20210913
301060.SZ,兰卫医学,上海,上海兰卫医学检验所股份有限公司,"Shanghai Labway Clinical Laboratory Co.,Ltd.",lwyx,创业板,20210913
301061.SZ,匠心家居,江苏,常州匠心独具智能家居股份有限公司,Hhc Changzhou Corp.,jxjj,创业板,20210913
301062.SZ,上海艾录,上海,上海艾录包装股份有限公司,"Shanghai Ailu Package Co.,Ltd.",shal,创业板,20210914
301063.SZ,海锅股份,江苏,张家港海锅新能源装备股份有限公司,"Zhangjiagang Haiguo New Energy Equipment Manufacturing Co., Ltd.",hggf,创业板,20210924
301065.SZ,本立科技,浙江,浙江本立科技股份有限公司,"Zhejiang Benli Technology Co.,Ltd",blkj,创业板,20210914
301066.SZ,万事利,浙江,杭州万事利丝绸文化股份有限公司,"Hangzhou Wensli Silk Culture Co.,Ltd",wsl,创业板,20210922
301067.SZ,显盈科技,深圳,深圳市显盈科技股份有限公司,"Fullink Technology Co.,Ltd",xykj,创业板,20210922
301068.SZ,大地海洋,浙江,杭州大地海洋环保股份有限公司,"Hangzhou Dadi Haiyang Environmental Protection Co., Ltd.",ddhy,创业板,20210928
301069.SZ,凯盛新材,山东,山东凯盛新材料股份有限公司,"Shandong Kaisheng New Materials Co.,Ltd.",ksxc,创业板,20210927
301070.SZ,开勒股份,上海,开勒环境科技(上海)股份有限公司,"Kale Environment Technology (Shanghai) Co., Ltd.",klgf,创业板,20210923
301071.SZ,力量钻石,河南,河南省力量钻石股份有限公司,"Henan Liliang Diamond Co., Ltd.",llzs,创业板,20210924
301072.SZ,中捷精工,江苏,江苏中捷精工科技股份有限公司,"Zhongjie (Jiangsu) Technology Co.,Ltd.",zjjg,创业板,20210929
301073.SZ,君亭酒店,浙江,浙江君亭酒店管理股份有限公司,"Zhejiang Ssaw Boutique Hotels Co.,Ltd",jtjd,创业板,20210930
301075.SZ,多瑞医药,西藏,西藏多瑞医药股份有限公司,"Tibet Duo Rui Pharmaceutical Co., Ltd.",dryy,创业板,20210929
301076.SZ,新瀚新材,江苏,江苏新瀚新材料股份有限公司,"Sino-High (China) Co.,Ltd",xhxc,创业板,20211011
301077.SZ,星华反光,浙江,杭州星华反光材料股份有限公司,"Hangzhou Chinastars Reflective Material Co.,Ltd",xhfg,创业板,20210930
301078.SZ,孩子王,江苏,孩子王儿童用品股份有限公司,"Kidswant Children Products Co.,Ltd.",hzw,创业板,20211014
301079.SZ,邵阳液压,湖南,邵阳维克液压股份有限公司,"Shaoyang Victor Hydraulics Co.,Ltd.",syyy,创业板,20211019
301080.SZ,百普赛斯,北京,北京百普赛斯生物科技股份有限公司,"Acrobiosystems Co.,Ltd.",bpss,创业板,20211018
301081.SZ,严牌股份,浙江,浙江严牌过滤技术股份有限公司,"Yanpai Filtration Technology Co.,Ltd.",ypgf,创业板,20211020
301082.SZ,久盛电气,浙江,久盛电气股份有限公司,"Jiusheng Electric Co., Ltd.",jsdq,创业板,20211027
301083.SZ,百胜智能,江西,江西百胜智能科技股份有限公司,"Bisen Smart Access Co.,Ltd.",bszn,创业板,20211021
301085.SZ,亚康股份,北京,北京亚康万玮信息技术股份有限公司,"Beijing Asiacom Information Technology Co., Ltd.",ykgf,创业板,20211018
301086.SZ,鸿富瀚,深圳,深圳市鸿富瀚科技股份有限公司,Shenzhen Hongfuhan Technology Co. Ltd.,hfh,创业板,20211020
301087.SZ,可孚医疗,湖南,可孚医疗科技股份有限公司,"Cofoe Medical Technology Co.,Ltd.",kfyl,创业板,20211025
301088.SZ,戎美股份,江苏,日禾戎美股份有限公司,"Rumere Co., Ltd.",rmgf,创业板,20211028
301089.SZ,拓新药业,河南,新乡拓新药业股份有限公司,"Xinxiang Tuoxin Pharmaceutical Co., Ltd.",txyy,创业板,20211027
301090.SZ,华润材料,江苏,华润化学材料科技股份有限公司,"China Resources Chemical Innovative Materials Co., Ltd.",hrcl,创业板,20211026
301091.SZ,深城交,深圳,深圳市城市交通规划设计研究中心股份有限公司,"Shenzhen Urban Transport Planning Center Co., Ltd",scj,创业板,20211029
301092.SZ,争光股份,浙江,浙江争光实业股份有限公司,"Zhejiang Zhengguang Industrial Co., Ltd.",zggf,创业板,20211102
301093.SZ,华兰股份,江苏,江苏华兰药用新材料股份有限公司,"Jiangsu Hualan New Pharmaceutical Material Co., Ltd",hlgf,创业板,20211101
301096.SZ,百诚医药,浙江,杭州百诚医药科技股份有限公司,"Hangzhou Bio-Sincerity Pharma-Tech Co., Ltd",bcyy,创业板,20211220
301098.SZ,金埔园林,江苏,金埔园林股份有限公司,"Jinpu Landscape Architecture Co.,Ltd.",jpyl,创业板,20211112
301099.SZ,雅创电子,上海,上海雅创电子集团股份有限公司,Shanghai Yct Electronics Group Co.，Ltd,ycdz,创业板,20211122
301100.SZ,风光股份,辽宁,营口风光新材料股份有限公司,"Yingkou Fengguang Advanced Material Co.,Ltd.",fggf,创业板,20211217
301101.SZ,明月镜片,江苏,明月镜片股份有限公司,"Mingyue Optical Lens Co.,Ltd.",myjp,创业板,20211216
301106.SZ,骏成科技,江苏,江苏骏成电子科技股份有限公司,"Jiangsu Smartwin Electronics Technology Co.,Ltd.",jckj,创业板,20220128
301108.SZ,洁雅股份,安徽,铜陵洁雅生物科技股份有限公司,"Tongling Jieya Biologic Technology Co.,Ltd.",jygf,创业板,20211203
301110.SZ,N青木,广东,青木数字技术股份有限公司,"Qingmu Digital Technology Co.,Ltd.",qmgf,创业板,20220311
301111.SZ,粤万年青,广东,广东万年青制药股份有限公司,"Guangdong Lifestrong Pharmacy Co., Ltd.",ywnq,创业板,20211207
301113.SZ,雅艺科技,浙江,浙江雅艺金属科技股份有限公司,"Zhejiang Yayi Metal Technology Co.,Ltd.",yykj,创业板,20211222
301116.SZ,益客食品,江苏,江苏益客食品集团股份有限公司,"Jiangsu Yike Food Group Co.,Ltd",yksp,创业板,20220118
301117.SZ,佳缘科技,四川,佳缘科技股份有限公司,"Jiayuan Science and Technology Co.,Ltd.",jykj,创业板,20220117
301118.SZ,恒光股份,湖南,湖南恒光科技股份有限公司,"Hunan Hengguang Technology Co., Ltd.",hggf,创业板,20211118
301119.SZ,正强股份,浙江,杭州正强传动股份有限公司,Hangzhou Zhengqiang Corporation Limited,zqgf,创业板,20211122
301122.SZ,采纳股份,江苏,采纳科技股份有限公司,"Caina Technology Co., Ltd.",cngf,创业板,20220126
301123.SZ,奕东电子,广东,奕东电子科技股份有限公司,"Yidong Electronics Technology Co.,Ltd.",yddz,创业板,20220125
301126.SZ,达嘉维康,湖南,湖南达嘉维康医药产业股份有限公司,"Hunan Dajiaweikang Pharmaceutical Industry Co.,Ltd.",djwk,创业板,20211207
301127.SZ,天源环保,湖北,武汉天源环保股份有限公司,"Wuhan Tianyuan Environmental Protection Co.,Ltd.",tyhb,创业板,20211230
301128.SZ,强瑞技术,深圳,深圳市强瑞精密技术股份有限公司,"Shenzhen Qiangrui Precision Technology Co., Ltd.",qrjs,创业板,20211110
301129.SZ,瑞纳智能,安徽,瑞纳智能设备股份有限公司,"Runa Smart Equipment Co.,Ltd.",rnzn,创业板,20211102
301130.SZ,西点药业,吉林,吉林省西点药业科技发展股份有限公司,"Jilin Province Xidian Pharmaceutical Sci-Tech Development Co.,Ltd.",xdyy,创业板,20220223
301131.SZ,聚赛龙,广东,广州市聚赛龙工程塑料股份有限公司,"Super-Dragon Engineering Plastics Co., Ltd",jsl,创业板,20220314
301133.SZ,金钟股份,广东,广州市金钟汽车零件股份有限公司,"Guangzhou Jinzhong Auto Parts Manufacturing Co., Ltd.",jzgf,创业板,20211126
301136.SZ,招标股份,福建,福建省招标股份有限公司,"Fujian Tendering Co., Ltd.",zbgf,创业板,20220111
301138.SZ,华研精机,广东,广州华研精密机械股份有限公司,"Guangzhou Huayan Precision Machinery Co.,Ltd.",hyjj,创业板,20211215
301149.SZ,隆华新材,山东,山东隆华新材料股份有限公司,"Shandong Longhua New Material Co.,Ltd.",lhxc,创业板,20211110
301155.SZ,海力风电,江苏,江苏海力风电设备科技股份有限公司,"Jiangsu Haili Wind Power Equipment Technology Co., Ltd.",hlfd,创业板,20211124
