ts_code,name,area,fullname,enname,cnspell,market,list_date
000001.SZ,平安银行,深圳,平安银行股份有限公司,"Ping An Bank Co., Ltd.",payh,主板,19910403
000002.SZ,万科A,深圳,万科企业股份有限公司,"China Vanke Co.,Ltd.",wka,主板,19910129
000004.SZ,国华网安,深圳,深圳国华网安科技股份有限公司,"Shenzhen Guohua Network Security Technology Co., Ltd.",ghwa,主板,19910114
000005.SZ,ST星源,深圳,深圳世纪星源股份有限公司,Shenzhen Fountain Corporation,stxy,主板,19901210
000006.SZ,深振业A,深圳,深圳市振业(集团)股份有限公司,"Shenzhen Zhenye(Group) Co.,Ltd.",szya,主板,19920427
000007.SZ,*ST全新,深圳,深圳市全新好股份有限公司,"Shenzhen Quanxinhao Co.,Ltd",stqx,主板,19920413
000008.SZ,神州高铁,北京,神州高铁技术股份有限公司,"China High Speed Railway Technology Co., Ltd.",szgt,主板,19920507
000009.SZ,中国宝安,深圳,中国宝安集团股份有限公司,"China Baoan Group Co.,Ltd.",zgba,主板,19910625
000010.SZ,美丽生态,深圳,深圳美丽生态股份有限公司,"Shenzhen Ecobeauty Co.,Ltd.",mlst,主板,19951027
000011.SZ,深物业A,深圳,深圳市物业发展(集团)股份有限公司,Shenzhen Properties & Resources Development (Group) Ltd.,swya,主板,19920330
000012.SZ,南玻A,深圳,中国南玻集团股份有限公司,"CSG Holding Co.,Ltd.",nba,主板,19920228
000014.SZ,沙河股份,深圳,沙河实业股份有限公司,"Shahe Industrial Co.,Ltd.",shgf,主板,19920602
000016.SZ,深康佳A,深圳,康佳集团股份有限公司,"Konka Group Co.,Ltd",skja,主板,19920327
000017.SZ,深中华A,深圳,深圳中华自行车(集团)股份有限公司,Shenzhen China Bicycle Company (Holdings) Limited,szha,主板,19920331
000019.SZ,深粮控股,深圳,深圳市深粮控股股份有限公司,"Shenzhen Cereals Holdings Co.,Ltd.",slkg,主板,19921012
000020.SZ,深华发A,深圳,深圳中恒华发股份有限公司,"Shenzhen Zhongheng Huafa Co.,Ltd.",shfa,主板,19920428
000021.SZ,深科技,深圳,深圳长城开发科技股份有限公司,"Shenzhen Kaifa Technology Co., Ltd.",skj,主板,19940202
000023.SZ,深天地A,深圳,深圳市天地(集团)股份有限公司,"Shenzhen Universe (Group) Co.,Ltd",stda,主板,19930429
000025.SZ,特力A,深圳,深圳市特力(集团)股份有限公司,"Shenzhen Tellus Holding Co.,Ltd",tla,主板,19930621
000026.SZ,飞亚达,深圳,飞亚达精密科技股份有限公司,"Fiyta Precision Technology Co., Ltd.",fyd,主板,19930603
000027.SZ,深圳能源,深圳,深圳能源集团股份有限公司,"Shenzhen Energy Group Co., Ltd.",szny,主板,19930903
000028.SZ,国药一致,深圳,国药集团一致药业股份有限公司,China National Accord Medicines Corporation Ltd.,gyyz,主板,19930809
000029.SZ,深深房A,深圳,深圳经济特区房地产(集团)股份有限公司,"Shenzhen Special Economic Zone Real Estate&Properties (Group).Co.,Ltd.",ssfa,主板,19930915
000030.SZ,富奥股份,吉林,富奥汽车零部件股份有限公司,Fawer Automotive Parts Limited Company,fagf,主板,19930929
000031.SZ,大悦城,深圳,大悦城控股集团股份有限公司,"Grandjoy Holdings Group Co.,Ltd.",dyc,主板,19931008
000032.SZ,深桑达A,深圳,深圳市桑达实业股份有限公司,"Shenzhen Sed Industry Co.,Ltd.",ssda,主板,19931028
000034.SZ,神州数码,深圳,神州数码集团股份有限公司,"Digital China Group Co.,Ltd.",szsm,主板,19940509
000035.SZ,中国天楹,江苏,中国天楹股份有限公司,China Tianying Inc.,zgty,主板,19940408
000036.SZ,华联控股,深圳,华联控股股份有限公司,China Union Holdings Ltd.,hlkg,主板,19940617
000037.SZ,深南电A,深圳,深圳南山热电股份有限公司,"Shenzhen Nanshan Power Co.,Ltd.",snda,主板,19940701
000038.SZ,深大通,深圳,深圳大通实业股份有限公司,"Shenzhen Capstone Industrial Co., Ltd.",sdt,主板,19940808
000039.SZ,中集集团,深圳,中国国际海运集装箱(集团)股份有限公司,"China International Marine Containers (Group) Co., Ltd",zjjt,主板,19940408
000040.SZ,东旭蓝天,深圳,东旭蓝天新能源股份有限公司,"Tunghsu Azure Renewable Energy Co., Ltd.",dxlt,主板,19940808
000042.SZ,中洲控股,深圳,深圳市中洲投资控股股份有限公司,"Shenzhen Centralcon Investment Holding Co., Ltd",zzkg,主板,19940921
000045.SZ,深纺织A,深圳,深圳市纺织(集团)股份有限公司,"Shenzhen Textile (Holdings) Co.,Ltd",sfza,主板,19940815
000046.SZ,泛海控股,北京,泛海控股股份有限公司,"Oceanwide Holdings Co., Ltd.",fhkg,主板,19940912
000048.SZ,京基智农,深圳,深圳市京基智农时代股份有限公司,"Shenzhen Kingkey Smart Agriculture Times Co.,Ltd",jjzn,主板,19941101
000049.SZ,德赛电池,深圳,深圳市德赛电池科技股份有限公司,"Shenzhen Desay Battery Technology Co., Ltd.",dsdc,主板,19950320
000050.SZ,深天马A,深圳,天马微电子股份有限公司,"Tianma Microelectronics Co.,Ltd.",stma,主板,19950315
000055.SZ,方大集团,深圳,方大集团股份有限公司,"China Fangda Group Co.,Ltd.",fdjt,主板,19960415
000056.SZ,皇庭国际,深圳,深圳市皇庭国际企业股份有限公司,"Shenzhen Wongtee International Enterprise Co., Ltd.",htgj,主板,19960708
000058.SZ,深赛格,深圳,深圳赛格股份有限公司,"Shenzhen Seg Co.,Ltd.",ssg,主板,19961226
000059.SZ,华锦股份,辽宁,北方华锦化学工业股份有限公司,"North Huajin Chemical Industries Co.,Ltd",hjgf,主板,19970130
000060.SZ,中金岭南,深圳,深圳市中金岭南有色金属股份有限公司,Shenzhen Zhongjin Lingnan Nonfemet Co. Ltd.,zjln,主板,19970123
000061.SZ,农产品,深圳,深圳市农产品集团股份有限公司,"Shenzhen Agricultural Products Group Co.,Ltd.",ncp,主板,19970110
000062.SZ,深圳华强,深圳,深圳华强实业股份有限公司,"Shenzhen Huaqiang Industry Co.,Ltd",szhq,主板,19970130
000063.SZ,中兴通讯,深圳,中兴通讯股份有限公司,ZTE Corporation,zxtx,主板,19971118
000065.SZ,北方国际,北京,北方国际合作股份有限公司,Norinco International Cooperation Ltd.,bfgj,主板,19980605
000066.SZ,中国长城,深圳,中国长城科技集团股份有限公司,"China Greatwall Technology Group Co., Ltd.",zgcc,主板,19970626
000068.SZ,华控赛格,深圳,深圳华控赛格股份有限公司,"Shenzhen Huakong Seg Co.,Ltd.",hksg,主板,19970611
000069.SZ,华侨城A,深圳,深圳华侨城股份有限公司,"Shenzhen Overseas Chinese Town Co.,Ltd.",hqca,主板,19970910
000070.SZ,特发信息,深圳,深圳市特发信息股份有限公司,"Shenzhen SDG Information Co., Ltd.",tfxx,主板,20000511
000078.SZ,海王生物,深圳,深圳市海王生物工程股份有限公司,"Shenzhen Neptunus Bioengineering Co.,Ltd",hwsw,主板,19981218
000088.SZ,盐田港,深圳,深圳市盐田港股份有限公司,"Shenzhen Yan Tian Port Holdings Co.,Ltd",ytg,主板,19970728
000089.SZ,深圳机场,深圳,深圳市机场股份有限公司,"Shenzhen Airport Co.,Ltd.",szjc,主板,19980420
000090.SZ,天健集团,深圳,深圳市天健(集团)股份有限公司,"Shenzhen Tagen Group Co., Ltd.",tjjt,主板,19990721
000096.SZ,广聚能源,深圳,深圳市广聚能源股份有限公司,"Shenzhen Guangju Energy Co.,Ltd.",gjny,主板,20000724
000099.SZ,中信海直,深圳,中信海洋直升机股份有限公司,"Citic Offshore Helicopter Co., Ltd.",zxhz,主板,20000731
000100.SZ,TCL科技,广东,TCL科技集团股份有限公司,TCL Technology Group Corporation,tclkj,主板,20040130
000150.SZ,宜华健康,广东,宜华健康医疗股份有限公司,"Yihua Healthcare Co.,Ltd.",yhjk,主板,20000807
000151.SZ,中成股份,北京,中成进出口股份有限公司,China National Complete Plant Import & Export Corporation Limited,zcgf,主板,20000906
000153.SZ,丰原药业,安徽,安徽丰原药业股份有限公司,"Anhui Fengyuan Pharmaceutical Co., Ltd.",fyyy,主板,20000920
000155.SZ,川能动力,四川,四川省新能源动力股份有限公司,Sichuan New Energypower Company Limited,cndl,主板,20000926
000156.SZ,华数传媒,浙江,华数传媒控股股份有限公司,"Wasu Media Holding Co.,Ltd",hscm,主板,20000906
000157.SZ,中联重科,湖南,中联重科股份有限公司,"Zoomlion Heavy Industry Science and Technology Co., Ltd.",zlzk,主板,20001012
000158.SZ,常山北明,河北,石家庄常山北明科技股份有限公司,"Shijiazhuang Changshan Beiming Technology Co., Ltd",csbm,主板,20000724
000159.SZ,国际实业,新疆,新疆国际实业股份有限公司,"Xinjiang International Industry Co.,Ltd",gjsy,主板,20000926
000166.SZ,申万宏源,新疆,申万宏源集团股份有限公司,"Shenwan Hongyuan Group Co.,Ltd.",swhy,主板,20150126
000301.SZ,东方盛虹,江苏,江苏东方盛虹股份有限公司,"Jiangsu Eastern Shenghong Co.,Ltd.",dfsh,主板,20000529
000333.SZ,美的集团,广东,美的集团股份有限公司,"Midea Group Co.,Ltd.",mdjt,主板,20130918
000338.SZ,潍柴动力,山东,潍柴动力股份有限公司,"Weichai Power Co.,Ltd.",wcdl,主板,20070430
000400.SZ,许继电气,河南,许继电气股份有限公司,"Xuji Electric Co.,Ltd.",xjdq,主板,19970418
000401.SZ,冀东水泥,河北,唐山冀东水泥股份有限公司,"Tangshan Jidong Cement Co.,Ltd.",jdsn,主板,19960614
000402.SZ,金融街,北京,金融街控股股份有限公司,"Financial Street Holdings Co., Ltd.",jrj,主板,19960626
000403.SZ,派林生物,山西,派斯双林生物制药股份有限公司,"Pacific Shuanglin Bio-pharmacy Co., LTD",plsw,主板,19960628
000404.SZ,长虹华意,江西,长虹华意压缩机股份有限公司,"Changhong Huayi Compressor Co., Ltd.",chhy,主板,19960619
000407.SZ,胜利股份,山东,山东胜利股份有限公司,"Shandong Shengli Co.,Ltd.",slgf,主板,19960703
000408.SZ,藏格矿业,青海,藏格矿业股份有限公司,Zangge Mining Company Limited,cgky,主板,19960628
000409.SZ,云鼎科技,山东,云鼎科技股份有限公司,"Yunding Technology Co.,Ltd.",ydkj,主板,19960627
000410.SZ,ST沈机,辽宁,沈阳机床股份有限公司,"Shenyang Machine Tool Co.,Ltd",stsj,主板,19960718
000411.SZ,英特集团,浙江,浙江英特集团股份有限公司,"Zhejiang Int'l Group Co.,Ltd",ytjt,主板,19960716
000413.SZ,东旭光电,河北,东旭光电科技股份有限公司,"Tunghsu Optoelectronic Technology Co., Ltd.",dxgd,主板,19960925
000415.SZ,渤海租赁,新疆,渤海租赁股份有限公司,"Bohai Leasing Co.,Ltd.",bhzl,主板,19960716
000416.SZ,民生控股,山东,民生控股股份有限公司,"Minsheng Holdings Co.,Ltd",mskg,主板,19960719
000417.SZ,合肥百货,安徽,合肥百货大楼集团股份有限公司,"Hefei Department Store Group Co.,Ltd",hfbh,主板,19960812
000419.SZ,通程控股,湖南,长沙通程控股股份有限公司,"Changsha Tongcheng Holdings Co.,Ltd",tckg,主板,19960816
000420.SZ,吉林化纤,吉林,吉林化纤股份有限公司,"Jilin Chemical Fibre Stock Co., Ltd.",jlhx,主板,19960802
000421.SZ,南京公用,江苏,南京公用发展股份有限公司,"NanJing Public Utilities Development Co.,Ltd.",njgy,主板,19960806
000422.SZ,湖北宜化,湖北,湖北宜化化工股份有限公司,"Hubei Yihua Chemical Industry Co.,Ltd",hbyh,主板,19960815
000423.SZ,东阿阿胶,山东,东阿阿胶股份有限公司,"Dong-E-E-Jiao Co., Ltd.",deej,主板,19960729
000425.SZ,徐工机械,江苏,徐工集团工程机械股份有限公司,"XCMG Construction Machinery Co., Ltd.",xgjx,主板,19960828
000426.SZ,兴业矿业,内蒙,内蒙古兴业矿业股份有限公司,"Inner Mongolia Xingye Mining Co.,Ltd",xyky,主板,19960828
000428.SZ,华天酒店,湖南,华天酒店集团股份有限公司,"Huatian Hotel Group Co.,Ltd.",htjd,主板,19960808
000429.SZ,粤高速A,广东,广东省高速公路发展股份有限公司,"Guangdong Provincial Expressway Development Co.,Ltd.",ygsa,主板,19980220
000430.SZ,张家界,湖南,张家界旅游集团股份有限公司,"Zhang Jia Jie Tourism Group Co., Ltd",zjj,主板,19960829
000488.SZ,晨鸣纸业,山东,山东晨鸣纸业集团股份有限公司,Shandong Chenming Paper Holdings Limited,cmzy,主板,20001120
000498.SZ,山东路桥,山东,山东高速路桥集团股份有限公司,"Shandong Hi-Speed Road&Bridge Group Co.,Ltd.",sdlq,主板,19970609
000501.SZ,鄂武商A,湖北,武汉武商集团股份有限公司,"Wuhan Department Store Group Co., Ltd.",ewsa,主板,19921120
000502.SZ,*ST绿景,广东,绿景控股股份有限公司,"Lvjing Holding Co., Ltd.",stlj,主板,19921123
000503.SZ,国新健康,海南,国新健康保障服务集团股份有限公司,"China Reform Health Management and Services Group Co., Ltd.",gxjk,主板,19921130
000504.SZ,南华生物,湖南,南华生物医药股份有限公司,"Nanhua Bio-Medicine Co.,Ltd.",nhsw,主板,19921208
000505.SZ,京粮控股,海南,海南京粮控股股份有限公司,"Hainan Jingliang Holdings Co., Ltd.",jlkg,主板,19921221
000506.SZ,中润资源,山东,中润资源投资股份有限公司,Zhongrun Resources Investment Corporation,zrzy,主板,19930312
000507.SZ,珠海港,广东,珠海港股份有限公司,"Zhuhai Port Co., Ltd",zhg,主板,19930326
000509.SZ,*ST华塑,四川,华塑控股股份有限公司,"Huasu Holdings Co.,Ltd",sths,主板,19930507
000510.SZ,新金路,四川,四川新金路集团股份有限公司,"Sichuan Xinjinlu Group Co.,Ltd",xjl,主板,19930507
000513.SZ,丽珠集团,广东,丽珠医药集团股份有限公司,Livzon Pharmaceutical Group Inc.,lzjt,主板,19931028
000514.SZ,渝开发,重庆,重庆渝开发股份有限公司,"Chongqing Yukaifa Co.,Ltd",ykf,主板,19930712
000516.SZ,ST国医,陕西,西安国际医学投资股份有限公司,Xi'An International Medical Investment Company Limited,stgy,主板,19930809
000517.SZ,荣安地产,浙江,荣安地产股份有限公司,"Rongan Property Co., Ltd.",radc,主板,19930806
000518.SZ,四环生物,江苏,江苏四环生物股份有限公司,"Jiangsu Sihuan Bioengineering Co.,Ltd",shsw,主板,19930908
000519.SZ,中兵红箭,湖南,中兵红箭股份有限公司,"North Industries Group Red Arrow Co., Ltd",zbhj,主板,19931008
000520.SZ,长航凤凰,湖北,长航凤凰股份有限公司,"Chang Jiang Shipping Group Phoenix Co.,Ltd",chfh,主板,19931025
000521.SZ,长虹美菱,安徽,长虹美菱股份有限公司,"Changhong Meiling CO.,LTD.",chml,主板,19931018
000523.SZ,*ST浪奇,广东,广州市浪奇实业股份有限公司,"Lonkey Industrial Co.,Ltd.Guangzhou",stlq,主板,19931108
000524.SZ,岭南控股,广东,广州岭南集团控股股份有限公司,Guangzhou Lingnan Group Holdings Company Limited,lnkg,主板,19931118
000525.SZ,ST红太阳,江苏,南京红太阳股份有限公司,"Nanjing Red Sun Co.,Ltd.",sthty,主板,19931028
000526.SZ,学大教育,福建,学大(厦门)教育科技集团股份有限公司,"Xueda (Xiamen) Education Technology Group Co., Ltd",xdjy,主板,19931101
000528.SZ,柳工,广西,广西柳工机械股份有限公司,"Guangxi Liugong Machinery Co.,Ltd.",lg,主板,19931118
000529.SZ,广弘控股,广东,广东广弘控股股份有限公司,"Guangdong Guanghong Holdings Co.,Ltd.",ghkg,主板,19931118
000530.SZ,冰山冷热,辽宁,冰山冷热科技股份有限公司,"Bingshan Refrigeration & Heat Transfer Technologies Co.,Ltd.",bslr,主板,19931208
000531.SZ,穗恒运A,广东,广州恒运企业集团股份有限公司,Guangzhou Hengyun Enterprises Holding Ltd,shya,主板,19940106
000532.SZ,华金资本,广东,珠海华金资本股份有限公司,"Zhuhai Huajin Capital Co.,Ltd.",hjzb,主板,19940103
000533.SZ,顺钠股份,广东,广东顺钠电气股份有限公司,"Guangdong Shunna Electric Co.,Ltd.",sngf,主板,19940103
000534.SZ,万泽股份,广东,万泽实业股份有限公司,"Wedge Industrial Co.,Ltd.",wzgf,主板,19940110
000536.SZ,华映科技,福建,华映科技(集团)股份有限公司,"Cpt Technology (Group) Co., Ltd",hykj,主板,19931126
000537.SZ,广宇发展,天津,天津广宇发展股份有限公司,"Tianjin Guangyu Development Co., Ltd.",gyfz,主板,19931210
000538.SZ,云南白药,云南,云南白药集团股份有限公司,"Yunnan Baiyao Group Co., Ltd.",ynby,主板,19931215
000539.SZ,粤电力A,广东,广东电力发展股份有限公司,"Guangdong Electric Power Development Co.,Ltd",ydla,主板,19931126
000540.SZ,中天金融,贵州,中天金融集团股份有限公司,Zhongtian Financial Group Company Limited,ztjr,主板,19940202
000541.SZ,佛山照明,广东,佛山电器照明股份有限公司,"Foshan Electrical and Lighting Co.,Ltd.",fszm,主板,19931123
000543.SZ,皖能电力,安徽,安徽省皖能股份有限公司,An Hui Wenergy Company Limited,wndl,主板,19931220
000544.SZ,中原环保,河南,中原环保股份有限公司,"Central Plains Environment Protection Co.,Ltd",zyhb,主板,19931208
000545.SZ,金浦钛业,吉林,金浦钛业股份有限公司,"Gpro Titanium Industry Co.,Ltd",jpty,主板,19931215
000546.SZ,金圆股份,吉林,金圆环保股份有限公司,"Jinyuan Ep Co.,Ltd",jygf,主板,19931215
000547.SZ,航天发展,福建,航天工业发展股份有限公司,"Addsino Co.,Ltd.",htfz,主板,19931130
000548.SZ,湖南投资,湖南,湖南投资集团股份有限公司,"Hunan Investment Group Co.,Ltd.",hntz,主板,19931220
000550.SZ,江铃汽车,江西,江铃汽车股份有限公司,"Jiangling Motors Corporation, Ltd.",jlqc,主板,19931201
000551.SZ,创元科技,江苏,创元科技股份有限公司,"Create Technology & Science Co., Ltd.",cykj,主板,19940106
000552.SZ,靖远煤电,甘肃,甘肃靖远煤电股份有限公司,"Gansu Jingyuan Coal Industry and Electricity Power Co.,Ltd",jymd,主板,19940106
000553.SZ,安道麦A,湖北,安道麦股份有限公司,ADAMA Ltd.,adma,主板,19931203
000554.SZ,泰山石油,山东,中国石化山东泰山石油股份有限公司,"Sinopec Shandong Taishan Pectroleum Co.,Ltd.",tssy,主板,19931215
000555.SZ,神州信息,深圳,神州数码信息服务股份有限公司,Digital China Information Service Company Ltd.,szxx,主板,19940408
000557.SZ,西部创业,宁夏,宁夏西部创业实业股份有限公司,"Ningxia Western Venture Industrial Co., Ltd.",xbcy,主板,19940617
000558.SZ,莱茵体育,浙江,莱茵达体育发展股份有限公司,"Lander Sports Development Co.,Ltd.",lyty,主板,19940509
000559.SZ,万向钱潮,浙江,万向钱潮股份有限公司,"Wanxiang Qianchao Co.,Ltd.",wxqc,主板,19940110
000560.SZ,我爱我家,云南,我爱我家控股集团股份有限公司,"5I5J Holding Group Co., Ltd.",wawj,主板,19940202
000561.SZ,烽火电子,陕西,陕西烽火电子股份有限公司,"Shaanxi Fenghuo Electronics Co., Ltd.",fhdz,主板,19940509
000563.SZ,陕国投A,陕西,陕西省国际信托股份有限公司,"Shaanxi International Trust Co.,Ltd",sgta,主板,19940110
000564.SZ,*ST大集,陕西,供销大集集团股份有限公司,"Ccoop Group Co., Ltd",stdj,主板,19940110
000565.SZ,渝三峡A,重庆,重庆三峡油漆股份有限公司,"Chongqing Sanxia Paints Co.,Ltd.",ysxa,主板,19940408
000566.SZ,海南海药,海南,海南海药股份有限公司,"Hainan Haiyao Co.,Ltd.",hnhy,主板,19940525
000567.SZ,海德股份,海南,海南海德资本管理股份有限公司,"Hainan Haide Capital Management Co.,Ltd.",hdgf,主板,19940525
000568.SZ,泸州老窖,四川,泸州老窖股份有限公司,"Luzhou Laojiao Co.,Ltd",lzlj,主板,19940509
000570.SZ,苏常柴A,江苏,常柴股份有限公司,"Changchai Company,Limited",scca,主板,19940701
000571.SZ,ST大洲,海南,新大洲控股股份有限公司,"Sundiro Holding Co.,Ltd.",stdz,主板,19940525
000572.SZ,海马汽车,海南,海马汽车股份有限公司,"Haima Automobile Co.,Ltd.",hmqc,主板,19940808
000573.SZ,粤宏远A,广东,东莞宏远工业区股份有限公司,DongGuan Winnerway Industry Zone LTD.,yhya,主板,19940815
000576.SZ,甘化科工,广东,广东甘化科工股份有限公司,"Guangdong Ganhua Science & Industry Co., Ltd.",ghkg,主板,19940907
000581.SZ,威孚高科,江苏,无锡威孚高科技集团股份有限公司,"Weifu High-Technology Group Co.,Ltd.",wfgk,主板,19980924
000582.SZ,北部湾港,广西,北部湾港股份有限公司,"Beibu Gulf Port Co., Ltd.",bbwg,主板,19951102
000584.SZ,哈工智能,江苏,江苏哈工智能机器人股份有限公司,"Jiangsu Hagong Intelligent Robot Co.,Ltd",hgzn,主板,19951128
000585.SZ,*ST东电,海南,东北电气发展股份有限公司,Northeast Electric Development Company Limited,stdd,主板,19951213
000586.SZ,汇源通信,四川,四川汇源光通信股份有限公司,"Sichuan Huiyuan Optical Communications Co.,Ltd.",hytx,主板,19951220
000587.SZ,*ST金洲,黑龙江,金洲慈航集团股份有限公司,"Jinzhou Cihang Group Co., Ltd",stjz,主板,19960425
000589.SZ,贵州轮胎,贵州,贵州轮胎股份有限公司,"Guizhou Tyre Co.,Ltd.",gzlt,主板,19960308
000590.SZ,启迪药业,湖南,启迪药业集团股份公司,"Tus-Pharmaceutical Group Co., Ltd.",qdyy,主板,19960119
000591.SZ,太阳能,重庆,中节能太阳能股份有限公司,"Cecep Solar Energy Co.,Ltd.",tyn,主板,19960208
000592.SZ,平潭发展,福建,中福海峡(平潭)发展股份有限公司,Zhongfu Straits (Pingtan) Development Company Limited,ptfz,主板,19960327
000593.SZ,德龙汇能,四川,德龙汇能集团股份有限公司,"Delong Composite Energy Group Co., Ltd",dlhn,主板,19960312
000595.SZ,宝塔实业,宁夏,宝塔实业股份有限公司,"Baota Industry Co.,Ltd.",btsy,主板,19960419
000596.SZ,古井贡酒,安徽,安徽古井贡酒股份有限公司,Anhui Gujing Distillery Company Limited,gjgj,主板,19960927
000597.SZ,东北制药,辽宁,东北制药集团股份有限公司,"Northeast Pharmaceutical Group Co., Ltd.",dbzy,主板,19960523
000598.SZ,兴蓉环境,四川,成都市兴蓉环境股份有限公司,"Chengdu Xingrong Environment Co., Ltd.",xrhj,主板,19960529
000599.SZ,青岛双星,山东,青岛双星股份有限公司,"Qingdao Doublestar Co.,Ltd",qdsx,主板,19960430
000600.SZ,建投能源,河北,河北建投能源投资股份有限公司,"Jointo Energy Investment Co.,Ltd.Hebei.",jtny,主板,19960606
000601.SZ,韶能股份,广东,广东韶能集团股份有限公司,"Guangdong Shaoneng Group Co.,Ltd",sngf,主板,19960830
000603.SZ,盛达资源,北京,盛达金属资源股份有限公司,"Shengda Resources Co.,Ltd.",sdzy,主板,19960823
000605.SZ,渤海股份,北京,渤海水业股份有限公司,"Bohai Water Industry Co., Ltd.",bhgf,主板,19960913
000606.SZ,ST顺利,青海,顺利办信息服务股份有限公司,"Shunliban Information Service Co., Ltd",stsl,主板,19961004
000607.SZ,华媒控股,浙江,浙江华媒控股股份有限公司,"Zhejiang Huamei Holding Co., Ltd.",hmkg,主板,19960830
000608.SZ,阳光股份,广西,阳光新业地产股份有限公司,"Yang Guang Co., Ltd.",yggf,主板,19960919
000609.SZ,*ST中迪,北京,北京中迪投资股份有限公司,"Beijing Zodi Investment Co., Ltd.",stzd,主板,19961010
000610.SZ,西安旅游,陕西,西安旅游股份有限公司,"Xi'an Tourism Co.,Ltd.",xaly,主板,19960926
000611.SZ,*ST天首,内蒙,内蒙古天首科技发展股份有限公司,"Inner Mongolia TianShou Technology&development, Co., Ltd.",stts,主板,19961008
000612.SZ,焦作万方,河南,焦作万方铝业股份有限公司,"Jiaozuo Wanfang Aluminum Manufacturing Co.,Ltd.",jzwf,主板,19960926
000613.SZ,*ST东海A,海南,海南大东海旅游中心股份有限公司,"Hainan Dadonghai Tourism Centre (Holdings) Co.,Ltd",stdha,主板,19970128
000615.SZ,奥园美谷,湖北,奥园美谷科技股份有限公司,"Aoyuan Beauty Valley Technology Co.,Ltd.",aymg,主板,19961016
000616.SZ,ST海投,辽宁,海航投资集团股份有限公司,"HNA Investment Group Co.,Ltd.",stht,主板,19961108
000617.SZ,中油资本,新疆,中国石油集团资本股份有限公司,Cnpc Capital Company Limited,zyzb,主板,19961022
000619.SZ,海螺型材,安徽,芜湖海螺型材科技股份有限公司,"Wuhu Conch Profiles and Science Co., Ltd",hlxc,主板,19961023
000620.SZ,新华联,北京,新华联文化旅游发展股份有限公司,"Macrolink Culturaltainment Development Co., Ltd.",xhl,主板,19961029
000622.SZ,恒立实业,湖南,恒立实业发展集团股份有限公司,"Hengli Industrial Development Group Co., Ltd.",hlsy,主板,19961107
000623.SZ,吉林敖东,吉林,吉林敖东药业集团股份有限公司,"Jilin Aodong Pharmaceutical Group Co., Ltd.",jlad,主板,19961028
000625.SZ,长安汽车,重庆,重庆长安汽车股份有限公司,Chongqing Changan Automobile Company Limited,caqc,主板,19970610
000626.SZ,远大控股,江苏,远大产业控股股份有限公司,"Grand Industrial Holding Co., Ltd",ydkg,主板,19961128
000627.SZ,天茂集团,湖北,天茂实业集团股份有限公司,"Hubei Biocause Pharmaceutical Co.,Ltd.",tmjt,主板,19961112
000628.SZ,高新发展,四川,成都高新发展股份有限公司,"Chengdu Hi-Tech Development Co., Ltd.",gxfz,主板,19961118
000629.SZ,攀钢钒钛,四川,攀钢集团钒钛资源股份有限公司,"Pangang Group Vanadium & Titanium Resources Co., Ltd.",pgft,主板,19961115
000630.SZ,铜陵有色,安徽,铜陵有色金属集团股份有限公司,"Tongling Nonferrous Metals Group Co.,Ltd",tlys,主板,19961120
000631.SZ,顺发恒业,吉林,顺发恒业股份公司,Shunfa Hengye Corporation.,sfhy,主板,19961122
000632.SZ,三木集团,福建,福建三木集团股份有限公司,"Fujian Sanmu Group Co.,Ltd.",smjt,主板,19961121
000633.SZ,合金投资,新疆,新疆合金投资股份有限公司,"Xinjiang Hejin Holding Co.,Ltd",hjtz,主板,19961112
000635.SZ,英力特,宁夏,宁夏英力特化工股份有限公司,"Ningxia Younglight Chemicals Co.,Ltd",ylt,主板,19961120
000636.SZ,风华高科,广东,广东风华高新科技股份有限公司,"Guangdong Fenghua Advanced Technology(Holding) Co.,Ltd",fhgk,主板,19961129
000637.SZ,茂化实华,广东,茂名石化实华股份有限公司,"Maoming Petro-Chemical Shihua Co., Ltd.",mhsh,主板,19961114
