ts_code,name,area,fullname,enname,cnspell,market,list_date
002749.SZ,国光股份,四川,四川国光农化股份有限公司,"Sichuan Guoguang Agrochemical Co., Ltd.",gggf,中小板,20150320
002750.SZ,龙津药业,云南,昆明龙津药业股份有限公司,"Kunming Longjin Pharmaceutical Co., Ltd.",ljyy,中小板,20150324
002751.SZ,易尚展示,深圳,深圳市易尚展示股份有限公司,"Shenzhen ESUN Display Co., Ltd.",yszs,中小板,20150424
002752.SZ,昇兴股份,福建,昇兴集团股份有限公司,Sunrise Group Company Limited,sxgf,中小板,20150422
002753.SZ,永东股份,山西,山西永东化工股份有限公司,"Shanxi Yongdong Chemistry Industry Co.,Ltd.",ydgf,中小板,20150519
002755.SZ,奥赛康,北京,北京奥赛康药业股份有限公司,"Beijing Aosaikang Pharmaceutical Co., Ltd.",ask,中小板,20150515
002756.SZ,永兴材料,浙江,永兴特种材料科技股份有限公司,"Yongxing Special Materials Technology Co.,Ltd",yxcl,中小板,20150515
002757.SZ,南兴股份,广东,南兴装备股份有限公司,"Nanxing Machinery Co., Ltd.",nxgf,中小板,20150527
002758.SZ,浙农股份,浙江,浙农集团股份有限公司,"Zjamp Group Co., Ltd.",zngf,中小板,20150527
002759.SZ,天际股份,广东,广东天际电器股份有限公司,"Guangdong Tonze Electric Co.,Ltd.",tjgf,中小板,20150528
002760.SZ,凤形股份,江西,凤形股份有限公司,"Fengxing Co., Ltd.",fxgf,中小板,20150611
002761.SZ,浙江建投,浙江,浙江省建设投资集团股份有限公司,"Zhejiang Construction Investment Group Co.,Ltd",zjjt,中小板,20150610
002762.SZ,金发拉比,广东,金发拉比妇婴童用品股份有限公司,"Jinfa Labi Maternity & Baby Articles Co., Ltd.",jflb,中小板,20150610
002763.SZ,汇洁股份,深圳,深圳汇洁集团股份有限公司,"Shenzhen Huijie Group Co., Ltd.",hjgf,中小板,20150610
002765.SZ,蓝黛科技,重庆,蓝黛科技集团股份有限公司,"Landai Technology Group Corp., Ltd.",ldkj,中小板,20150612
002766.SZ,*ST索菱,深圳,深圳市索菱实业股份有限公司,"Shenzhen Soling Industrial Co.,Ltd.",stsl,中小板,20150611
002767.SZ,先锋电子,浙江,杭州先锋电子技术股份有限公司,"Hangzhou Innover Technology Co., Ltd.",xfdz,中小板,20150612
002768.SZ,国恩股份,山东,青岛国恩科技股份有限公司,"Qingdao Gon Technology Co., Ltd.",gegf,中小板,20150630
002769.SZ,普路通,深圳,深圳市普路通供应链管理股份有限公司,"Shenzhen Prolto Supply Chain Management Co., Ltd.",plt,中小板,20150629
002770.SZ,*ST科迪,河南,河南科迪乳业股份有限公司,"Henan Kedi Dairy Co.,Ltd.",stkd,中小板,20150630
002771.SZ,真视通,北京,北京真视通科技股份有限公司,Beijing Transtrue Technology Inc.,zst,中小板,20150629
002772.SZ,众兴菌业,甘肃,天水众兴菌业科技股份有限公司,"Tianshui Zhongxing Bio-Technology Co.,Ltd.",zxjy,中小板,20150626
002773.SZ,康弘药业,四川,成都康弘药业集团股份有限公司,"Chengdu Kanghong Pharmaceutical Group Co., Ltd",khyy,中小板,20150626
002774.SZ,快意电梯,广东,快意电梯股份有限公司,"Ife Elevators Co.,Ltd.",kydt,中小板,20170324
002775.SZ,文科园林,深圳,深圳文科园林股份有限公司,"Shenzhen Wenke Landscape Co.,Ltd.",wkyl,中小板,20150629
002776.SZ,ST柏龙,广东,广东柏堡龙股份有限公司,"Guangdong Bobaolon Co.,Ltd.",stbl,中小板,20150626
002777.SZ,久远银海,四川,四川久远银海软件股份有限公司,"Sichuan Jiuyuan Yinhai Software Co.,Ltd",jyyh,中小板,20151231
002778.SZ,中晟高科,江苏,江苏中晟高科环境股份有限公司,"Jiangsu Zhongsheng Gaoke Environmental Co.,Ltd.",zsgk,中小板,20160106
002779.SZ,中坚科技,浙江,浙江中坚科技股份有限公司,"Zhejiang Zhongjian Technology Co ,.Ltd.",zjkj,中小板,20151209
002780.SZ,三夫户外,北京,北京三夫户外用品股份有限公司,"Beijing Sanfo Outdoor Products Co., Ltd",sfhw,中小板,20151209
002781.SZ,奇信股份,江西,江西奇信集团股份有限公司,"Jiangxi Qixin Group Co., Ltd.",qxgf,中小板,20151222
002782.SZ,可立克,深圳,深圳可立克科技股份有限公司,"Shenzhen Click Technology Co., Ltd.",klk,中小板,20151222
002783.SZ,凯龙股份,湖北,湖北凯龙化工集团股份有限公司,"Hubei Kailong Chemical Group Co.,Ltd",klgf,中小板,20151209
002785.SZ,万里石,福建,厦门万里石股份有限公司,"Xiamen Wanli Stone Stock Co.,Ltd",wls,中小板,20151223
002786.SZ,银宝山新,深圳,深圳市银宝山新科技股份有限公司,"Shenzhen Silver Basis Technology Co.,Ltd.",ybsx,中小板,20151223
002787.SZ,华源控股,江苏,苏州华源控股股份有限公司,"Suzhou Hycan Holdings Co., Ltd",hykg,中小板,20151231
002788.SZ,鹭燕医药,福建,鹭燕医药股份有限公司,"Luyan Pharma Co.,Ltd",lyyy,中小板,20160218
002789.SZ,建艺集团,深圳,深圳市建艺装饰集团股份有限公司,"Shenzhen Jianyi Decoration Group Co.,Ltd.",jyjt,中小板,20160311
002790.SZ,瑞尔特,福建,厦门瑞尔特卫浴科技股份有限公司,"Xiamen R&T Plumbing Technology Co., Ltd.",ret,中小板,20160308
002791.SZ,坚朗五金,广东,广东坚朗五金制品股份有限公司,"Guangdong Kinlong Hardware Products Co.,Ltd.",jlwj,中小板,20160329
002792.SZ,通宇通讯,广东,广东通宇通讯股份有限公司,Tongyu Communication Inc.,tytx,中小板,20160328
002793.SZ,罗欣药业,浙江,罗欣药业集团股份有限公司,"Luoxin Pharmaceuticals Group Stock Co., Ltd.",lxyy,中小板,20160415
002795.SZ,永和智控,浙江,永和流体智控股份有限公司,"Yorhe Fluid Intelligent Control Co., Ltd",yhzk,中小板,20160428
002796.SZ,世嘉科技,江苏,苏州市世嘉科技股份有限公司,Suzhou Shijia Science & Technology Inc.,sjkj,中小板,20160510
002797.SZ,第一创业,深圳,第一创业证券股份有限公司,"First Capital Securities Co.,Ltd",dycy,中小板,20160511
002798.SZ,帝欧家居,四川,帝欧家居集团股份有限公司,"D&O Home Collection Group Co.,Ltd",dojj,中小板,20160525
002799.SZ,环球印务,陕西,西安环球印务股份有限公司,"Xi'An Global Printing Co., Ltd",hqyw,中小板,20160608
002800.SZ,天顺股份,新疆,新疆天顺供应链股份有限公司,"Xinjiang Tianshun Supply Chain Co.,Ltd.",tsgf,中小板,20160530
002801.SZ,微光股份,浙江,杭州微光电子股份有限公司,"Hangzhou Weiguang Electronic Co.,Ltd.",wggf,中小板,20160622
002802.SZ,洪汇新材,江苏,无锡洪汇新材料科技股份有限公司,"Wuxi Honghui New Materials Technology Co.,Ltd.",hhxc,中小板,20160629
002803.SZ,吉宏股份,福建,厦门吉宏科技股份有限公司,"Xiamen Jihong Technology Co.,Ltd",jhgf,中小板,20160712
002805.SZ,丰元股份,山东,山东丰元化学股份有限公司,"Shandong Fengyuan Chemical Co.,Ltd.",fygf,中小板,20160707
002806.SZ,华锋股份,广东,广东华锋新能源科技股份有限公司,"Guangdong Huafeng New Energy Technology Co.,Ltd.",hfgf,中小板,20160726
002807.SZ,江阴银行,江苏,江苏江阴农村商业银行股份有限公司,"Jiangsu Jiangyin Rural Commercial Bank Co.,Ltd.",jyyh,中小板,20160902
002808.SZ,恒久科技,江苏,苏州恒久光电科技股份有限公司,Suzhou Goldengreen Technologies Ltd.,hjkj,中小板,20160812
002809.SZ,红墙股份,广东,广东红墙新材料股份有限公司,"Guangdong Redwall New Materials Co., Ltd.",hqgf,中小板,20160823
002810.SZ,山东赫达,山东,山东赫达集团股份有限公司,"Shandong Head Group Co.,Ltd.",sdhd,中小板,20160826
002811.SZ,郑中设计,深圳,深圳市郑中设计股份有限公司,"Shenzhen Cheng Chung Design Co.,Ltd.",zzsj,中小板,20160908
002812.SZ,恩捷股份,云南,云南恩捷新材料股份有限公司,"Yunnan Energy New Material Co.,Ltd.",ejgf,中小板,20160914
002813.SZ,路畅科技,深圳,深圳市路畅科技股份有限公司,"Shenzhen Roadrover Technology Co., Ltd",lckj,中小板,20161012
002815.SZ,崇达技术,深圳,崇达技术股份有限公司,"Suntak Technology Co., Ltd.",cdjs,中小板,20161012
002816.SZ,和科达,深圳,深圳市和科达精密清洗设备股份有限公司,"Shenzhen Hekeda Precision Cleaning Equipment Co., Ltd.",hkd,中小板,20161025
002817.SZ,黄山胶囊,安徽,安徽黄山胶囊股份有限公司,"Anhui Huangshan Capsule Co.,Ltd.",hsjn,中小板,20161025
002818.SZ,富森美,四川,成都富森美家居股份有限公司,"Chengdu Fusen Noble-House Industrial Co.,Ltd.",fsm,中小板,20161109
002819.SZ,东方中科,北京,北京东方中科集成科技股份有限公司,"Beijing Oriental Jicheng  Co., Ltd.",dfzk,中小板,20161111
002820.SZ,桂发祥,天津,天津桂发祥十八街麻花食品股份有限公司,"Tianjin Guifaxiang 18th Street Mahua Food Co., Ltd.",gfx,中小板,20161118
002821.SZ,凯莱英,天津,凯莱英医药集团(天津)股份有限公司,"Asymchem Laboratories (Tianjin) Co., Ltd.",kly,中小板,20161118
002822.SZ,中装建设,深圳,深圳市中装建设集团股份有限公司,"Shenzhen Zhongzhuang Construction Group Co.,Ltd.",zzjs,中小板,20161129
002823.SZ,凯中精密,深圳,深圳市凯中精密技术股份有限公司,"Shenzhen Kaizhong Precision Technology Co.,Ltd.",kzjm,中小板,20161124
002824.SZ,和胜股份,广东,广东和胜工业铝材股份有限公司,"Guangdong Hoshion Industrial Aluminium Co., Ltd.",hsgf,中小板,20170112
002825.SZ,纳尔股份,上海,上海纳尔实业股份有限公司,"Shanghai Nar Industrial Co., Ltd.",negf,中小板,20161129
002826.SZ,易明医药,西藏,西藏易明西雅医药科技股份有限公司,Tibet Aim Pharm. Inc.,ymyy,中小板,20161209
002827.SZ,高争民爆,西藏,西藏高争民爆股份有限公司,"Tibet Gaozheng Explosive Co., Ltd.",gzmb,中小板,20161209
002828.SZ,贝肯能源,新疆,新疆贝肯能源工程股份有限公司,"Xinjiang Beiken Energy Engineering Co.,Ltd.",bkny,中小板,20161208
002829.SZ,星网宇达,北京,北京星网宇达科技股份有限公司,"BeiJing StarNeto Technology Co.,Ltd.",xwyd,中小板,20161213
002830.SZ,名雕股份,深圳,深圳市名雕装饰股份有限公司,"Shenzhen Mingdiao Decoration Co., Ltd.",mdgf,中小板,20161213
002831.SZ,裕同科技,深圳,深圳市裕同包装科技股份有限公司,"Shenzhen Yuto Packaging Technology Co., Ltd.",ytkj,中小板,20161216
002832.SZ,比音勒芬,广东,比音勒芬服饰股份有限公司,"Biem.L.Fdlkk Garment Co.,Ltd.",bylf,中小板,20161223
002833.SZ,弘亚数控,广东,广州弘亚数控机械股份有限公司,"Guangzhou Kdt Machinery Co.,Ltd.",hysk,中小板,20161228
002835.SZ,同为股份,深圳,深圳市同为数码科技股份有限公司,"Shenzhen Tvt Digital Technology Co.,Ltd.",twgf,中小板,20161228
002836.SZ,新宏泽,广东,广东新宏泽包装股份有限公司,"Guangdong New Grand Long Packing Co.,Ltd.",xhz,中小板,20161229
002837.SZ,英维克,深圳,深圳市英维克科技股份有限公司,"Shenzhen Envicool Technology Co.,Ltd.",ywk,中小板,20161229
002838.SZ,道恩股份,山东,山东道恩高分子材料股份有限公司,"Shandong Dawn Polymer Co.,Ltd.",degf,中小板,20170106
002839.SZ,张家港行,江苏,江苏张家港农村商业银行股份有限公司,"Jiangsu Zhangjiagang Rural Commercial Bank Co.,Ltd",zjgh,中小板,20170124
002840.SZ,华统股份,浙江,浙江华统肉制品股份有限公司,"Zhejiang Huatong Meat Products Co., Ltd.",htgf,中小板,20170110
002841.SZ,视源股份,广东,广州视源电子科技股份有限公司,Guangzhou Shiyuan Electronic Technology Company Limited,sygf,中小板,20170119
002842.SZ,翔鹭钨业,广东,广东翔鹭钨业股份有限公司,"Guangdong Xianglu Tungsten Co., Ltd.",xlwy,中小板,20170119
002843.SZ,泰嘉股份,湖南,湖南泰嘉新材料科技股份有限公司,"Bichamp Cutting Technology (Hunan)Co.,Ltd.",tjgf,中小板,20170120
002845.SZ,同兴达,深圳,深圳同兴达科技股份有限公司,"Shenzhen Txd Technology Co.,Ltd.",txd,中小板,20170125
002846.SZ,英联股份,广东,广东英联包装股份有限公司,"Guangdong Enpack Packaging Co.,Ltd.",ylgf,中小板,20170207
002847.SZ,盐津铺子,湖南,盐津铺子食品股份有限公司,"Yanker Shop Food Co., Ltd",yjpz,中小板,20170208
002848.SZ,高斯贝尔,湖南,高斯贝尔数码科技股份有限公司,"Gospell Digital Technology Co., Ltd.",gsbe,中小板,20170213
002849.SZ,威星智能,浙江,浙江威星智能仪表股份有限公司,"Zhejiang Viewshine Intelligent Meter Co.,Ltd",wxzn,中小板,20170217
002850.SZ,科达利,深圳,深圳市科达利实业股份有限公司,"Shenzhen Kedali Industry Co.,Ltd",kdl,中小板,20170302
002851.SZ,麦格米特,深圳,深圳麦格米特电气股份有限公司,"Shenzhen Megmeet Electrical Co., Ltd",mgmt,中小板,20170306
002852.SZ,道道全,湖南,道道全粮油股份有限公司,"Daodaoquan Grain and Oil Co.,Ltd.",ddq,中小板,20170310
002853.SZ,皮阿诺,广东,广东皮阿诺科学艺术家居股份有限公司,"Guangdong Piano Customized Furniture Co.,Ltd.",pan,中小板,20170310
002855.SZ,捷荣技术,广东,东莞捷荣技术股份有限公司,"Dongguan Chitwing Technology Co.,Ltd.",jrjs,中小板,20170321
002856.SZ,美芝股份,深圳,深圳市美芝装饰设计工程股份有限公司,"Shenzhen Magic Design & Decoration Engineering Co.,Ltd",mzgf,中小板,20170320
002857.SZ,三晖电气,河南,郑州三晖电气股份有限公司,"Sms Electric Co.,Ltd.Zhengzhou",shdq,中小板,20170323
002858.SZ,力盛赛车,上海,上海力盛赛车文化股份有限公司,"Shanghai Lisheng Racing Co.,Ltd.",lssc,中小板,20170324
002859.SZ,洁美科技,浙江,浙江洁美电子科技股份有限公司,"Zhejiang Jiemei Electronic and Technology Co.,Ltd.",jmkj,中小板,20170407
002860.SZ,星帅尔,浙江,杭州星帅尔电器股份有限公司,"Hangzhou Star Shuaier Electric Appliance Co.,Ltd.",xse,中小板,20170412
002861.SZ,瀛通通讯,湖北,瀛通通讯股份有限公司,"YingTong Telecommunication Co., Ltd.",yttx,中小板,20170413
002862.SZ,实丰文化,广东,实丰文化发展股份有限公司,"Shifeng Cultural Development Co., Ltd.",sfwh,中小板,20170411
002863.SZ,今飞凯达,浙江,浙江今飞凯达轮毂股份有限公司,"Zhejiang Jinfei Kaida Wheel Co.,Ltd.",jfkd,中小板,20170418
002864.SZ,盘龙药业,陕西,陕西盘龙药业集团股份有限公司,Shaanxi Panlong Pharmaceutical Group Limited By Share Ltd,plyy,中小板,20171116
002865.SZ,钧达股份,海南,海南钧达汽车饰件股份有限公司,"Hainan Drinda Automotive Trim Co.,Ltd",jdgf,中小板,20170425
002866.SZ,传艺科技,江苏,江苏传艺科技股份有限公司,"Jiangsu Transimage Technology Co., Ltd.",cykj,中小板,20170426
002867.SZ,周大生,深圳,周大生珠宝股份有限公司,"Chow Tai Seng Jewellery Co.,Ltd.",zds,中小板,20170427
002868.SZ,绿康生化,福建,绿康生化股份有限公司,"Lifecome Biochemistry Co., Ltd.",lksh,中小板,20170503
002869.SZ,金溢科技,深圳,深圳市金溢科技股份有限公司,"Shenzhen Genvict Technologies Co., Ltd.",jykj,中小板,20170515
002870.SZ,香山股份,广东,广东香山衡器集团股份有限公司,Guangdong Senssun Weighing Apparatus Group Ltd.,xsgf,中小板,20170515
002871.SZ,伟隆股份,山东,青岛伟隆阀门股份有限公司,"Qingdao Weflo Valve Co., Ltd.",wlgf,中小板,20170511
002872.SZ,ST天圣,重庆,天圣制药集团股份有限公司,"Tiansheng Pharmaceutical Group Co., Ltd",stts,中小板,20170519
002873.SZ,新天药业,贵州,贵阳新天药业股份有限公司,"Guiyang Xintian Pharmaceutical Co.,Ltd.",xtyy,中小板,20170519
002875.SZ,安奈儿,深圳,深圳市安奈儿股份有限公司,"Annil Co.,Ltd",ane,中小板,20170601
002876.SZ,三利谱,深圳,深圳市三利谱光电科技股份有限公司,"Shenzhen Sunnypol Optoelectronics Co., Ltd",slp,中小板,20170525
002877.SZ,智能自控,江苏,无锡智能自控工程股份有限公司,"Wuxi Smart Auto-Control Engineering Co.,Ltd.",znzk,中小板,20170605
002878.SZ,元隆雅图,北京,北京元隆雅图文化传播股份有限公司,"Beijing Yuanlong Yato Culture Dissemination Co.,Ltd.",ylyt,中小板,20170606
002879.SZ,长缆科技,湖南,长缆电工科技股份有限公司,"Chang Lan Electric Technology Co.,Ltd.",clkj,中小板,20170707
002880.SZ,卫光生物,深圳,深圳市卫光生物制品股份有限公司,"Shenzhen Weiguang Biological Products Co.,Ltd",wgsw,中小板,20170616
002881.SZ,美格智能,深圳,美格智能技术股份有限公司,"Meig Smart Technology Co,. Ltd",mgzn,中小板,20170622
002882.SZ,金龙羽,深圳,金龙羽集团股份有限公司,"Jinlongyu Group Co., Ltd.",jly,中小板,20170717
002883.SZ,中设股份,江苏,江苏中设集团股份有限公司,"Jiangsu Zhongshe Group Co., Ltd.",zsgf,中小板,20170620
002884.SZ,凌霄泵业,广东,广东凌霄泵业股份有限公司,"Guangdong Lingxiao Pump Industry Co., Ltd.",lxby,中小板,20170711
002885.SZ,京泉华,深圳,深圳市京泉华科技股份有限公司,"Shenzhen Jingquanhua Electronics Co.,Ltd.",jqh,中小板,20170627
002886.SZ,沃特股份,深圳,深圳市沃特新材料股份有限公司,"Shenzhen Wote Advanced Materials Co.,Ltd.",wtgf,中小板,20170627
002887.SZ,绿茵生态,天津,天津绿茵景观生态建设股份有限公司,"Tianjin Lvyin Landscape and Ecology Construction Co., Ltd",lyst,中小板,20170801
002888.SZ,惠威科技,广东,广州惠威电声科技股份有限公司,"Hivi Acoustics Technology Co., Ltd",hwkj,中小板,20170721
002889.SZ,东方嘉盛,深圳,深圳市东方嘉盛供应链股份有限公司,"Shenzhen Easttop Supply Chain Management Co., Ltd.",dfjs,中小板,20170731
002890.SZ,弘宇股份,山东,山东弘宇农机股份有限公司,"Shandong Hongyu Agricultural Machinery Co., Ltd.",hygf,中小板,20170802
002891.SZ,中宠股份,山东,烟台中宠食品股份有限公司,"Yantai China Pet Foods Co., Ltd.",zcgf,中小板,20170821
002892.SZ,科力尔,湖南,科力尔电机集团股份有限公司,"Keli Motor Group Co.,Ltd.",kle,中小板,20170817
002893.SZ,华通热力,北京,北京华远意通热力科技股份有限公司,"Beijing Huayuan Yitong Thermal Technology Co., Ltd.",htrl,中小板,20170915
002895.SZ,川恒股份,贵州,贵州川恒化工股份有限公司,Guizhou Chanhen Chemical Corporation,chgf,中小板,20170825
002896.SZ,中大力德,浙江,宁波中大力德智能传动股份有限公司,"Ningbo Zhongda Leader Intelligent Transmission Co., Ltd.",zdld,中小板,20170829
002897.SZ,意华股份,浙江,温州意华接插件股份有限公司,"Wenzhou Yihua Connector Co., Ltd.",yhgf,中小板,20170907
002898.SZ,赛隆药业,广东,赛隆药业集团股份有限公司,"Sailong Pharmaceutical Group Co.,Ltd.",slyy,中小板,20170912
002899.SZ,英派斯,山东,青岛英派斯健康科技股份有限公司,"Impulse (Qingdao) Health Tech Co., Ltd.",yps,中小板,20170915
002900.SZ,哈三联,黑龙江,哈尔滨三联药业股份有限公司,"Harbin Medisan Pharmaceutical Co., Ltd .",hsl,中小板,20170922
002901.SZ,大博医疗,福建,大博医疗科技股份有限公司,Double Medical Technology Inc.,dbyl,中小板,20170922
002902.SZ,铭普光磁,广东,东莞铭普光磁股份有限公司,"Dongguan Mentech Optical & Magnetic Co.,Ltd.",mpgc,中小板,20170929
002903.SZ,宇环数控,湖南,宇环数控机床股份有限公司,"Yuhuan Cnc Machine Tool Co.,Ltd.",yhsk,中小板,20171013
002905.SZ,金逸影视,广东,广州金逸影视传媒股份有限公司,Guangzhou Jinyi Media Corporation,jyys,中小板,20171016
002906.SZ,华阳集团,广东,惠州市华阳集团股份有限公司,Foryou Corporation,hyjt,中小板,20171013
002907.SZ,华森制药,重庆,重庆华森制药股份有限公司,"Chongqing Pharscin Pharmaceutical Co., Ltd.",hszy,中小板,20171020
002908.SZ,德生科技,广东,广东德生科技股份有限公司,"Guangdong Tecsun Science & Technology Co.,Ltd.",dskj,中小板,20171020
002909.SZ,集泰股份,广东,广州集泰化工股份有限公司,"Guangzhou Jointas Chemical Co.,Ltd.",jtgf,中小板,20171026
002910.SZ,庄园牧场,甘肃,兰州庄园牧场股份有限公司,"Lanzhou Zhuangyuan Pasture Co., Ltd.",zymc,中小板,20171031
002911.SZ,佛燃能源,广东,佛燃能源集团股份有限公司,"Foran Energy Group Co.,Ltd.",frny,中小板,20171122
002912.SZ,中新赛克,深圳,深圳市中新赛克科技股份有限公司,"Shenzhen Sinovatio Technology Co., Ltd.",zxsk,中小板,20171121
002913.SZ,奥士康,湖南,奥士康科技股份有限公司,"Aoshikang Technology Co.,Ltd",ask,中小板,20171201
002915.SZ,中欣氟材,浙江,浙江中欣氟材股份有限公司,"Zhejiang Zhongxin Fluoride Materials Co., Ltd",zxfc,中小板,20171205
002916.SZ,深南电路,深圳,深南电路股份有限公司,"Shennan Circuits Co., Ltd.",sndl,中小板,20171213
002917.SZ,金奥博,深圳,深圳市金奥博科技股份有限公司,Shenzhen King Explorer Science And Technology Corporation,jab,中小板,20171208
002918.SZ,蒙娜丽莎,广东,蒙娜丽莎集团股份有限公司,"Monalisa Group Co.,Ltd",mnls,中小板,20171219
002919.SZ,名臣健康,广东,名臣健康用品股份有限公司,"Mingchen Health Co.,Ltd.",mcjk,中小板,20171218
002920.SZ,德赛西威,广东,惠州市德赛西威汽车电子股份有限公司,"Huizhou Desay Sv Automotive Co., Ltd.",dsxw,中小板,20171226
002921.SZ,联诚精密,山东,山东联诚精密制造股份有限公司,"Shandong Liancheng Precision Manufacturing Co., Ltd",lcjm,中小板,20171227
002922.SZ,伊戈尔,广东,伊戈尔电气股份有限公司,"Eaglerise Electric & Electronic (China) Co., Ltd",yge,中小板,20171229
002923.SZ,润都股份,广东,珠海润都制药股份有限公司,"Zhuhai Rundu Pharmaceutical Co.,Ltd.",rdgf,中小板,20180105
002925.SZ,盈趣科技,福建,厦门盈趣科技股份有限公司,Xiamen Intretech Inc.,yqkj,中小板,20180115
002926.SZ,华西证券,四川,华西证券股份有限公司,"Huaxi Securities Co.,Ltd.",hxzq,中小板,20180205
002927.SZ,泰永长征,贵州,贵州泰永长征技术股份有限公司,"Guizhou Taiyong-Changzheng Technology Co.,Ltd.",tycz,中小板,20180223
002928.SZ,华夏航空,贵州,华夏航空股份有限公司,"China Express Airlines Co.,LTD",hxhk,中小板,20180302
002929.SZ,润建股份,广西,润建股份有限公司,"Runjian Co., Ltd.",rjgf,中小板,20180301
002930.SZ,宏川智慧,广东,广东宏川智慧物流股份有限公司,"Guangdong Great River Smarter Logistics Co.,Ltd.",hczh,中小板,20180328
002931.SZ,锋龙股份,浙江,浙江锋龙电气股份有限公司,"Zhejiang Fenglong Electric Co.,Ltd.",flgf,中小板,20180403
002932.SZ,明德生物,湖北,武汉明德生物科技股份有限公司,"Wuhan Easy Diagnosis Biomedicine Co.,Ltd.",mdsw,中小板,20180710
002933.SZ,新兴装备,北京,北京新兴东方航空装备股份有限公司,"Beijing Emerging Eastern Aviation Equipment Co., Ltd.",xxzb,中小板,20180828
002935.SZ,天奥电子,四川,成都天奥电子股份有限公司,"Chengdu Spaceon Electronics Co., Ltd.",tadz,中小板,20180903
002936.SZ,郑州银行,河南,郑州银行股份有限公司,"Bank of Zhengzhou Co.,Ltd.",zzyh,中小板,20180919
002937.SZ,兴瑞科技,浙江,宁波兴瑞电子科技股份有限公司,"Ningbo Sunrise Elc Technology Co.,Ltd",xrkj,中小板,20180926
002938.SZ,鹏鼎控股,深圳,鹏鼎控股(深圳)股份有限公司,"Avary Holding (Shenzhen) Co., Limited",pdkg,中小板,20180918
002939.SZ,长城证券,深圳,长城证券股份有限公司,"China Great Wall Securities Co.,Ltd.",cczq,中小板,20181026
002940.SZ,昂利康,浙江,浙江昂利康制药股份有限公司,"Zhejiang Anglikang Pharmaceutical Co.,Ltd.",alk,中小板,20181023
002941.SZ,新疆交建,新疆,新疆交通建设集团股份有限公司,"Xinjiang Communications Construction Group Co.,Ltd.",xjjj,中小板,20181128
002942.SZ,新农股份,浙江,浙江新农化工股份有限公司,"Zhejiang Xinnong Chemical Co.,Ltd.",xngf,中小板,20181205
002943.SZ,宇晶股份,湖南,湖南宇晶机器股份有限公司,"Hunan Yujing Machinery Co., Ltd",yjgf,中小板,20181129
002945.SZ,华林证券,西藏,华林证券股份有限公司,"Chinalin Securities Co.,Ltd.",hlzq,中小板,20190117
002946.SZ,新乳业,四川,新希望乳业股份有限公司,"New Hope Dairy Co., Ltd.",xry,中小板,20190125
002947.SZ,恒铭达,江苏,苏州恒铭达电子科技股份有限公司,"Suzhou Hengmingda Electronic Technology Co., Ltd.",hmd,中小板,20190201
002948.SZ,青岛银行,山东,青岛银行股份有限公司,"Bank of Qingdao Co.,Ltd.",qdyh,中小板,20190116
002949.SZ,华阳国际,深圳,深圳市华阳国际工程设计股份有限公司,"Shenzhen Capol International & Associates Co.,Ltd",hygj,中小板,20190226
002950.SZ,奥美医疗,湖北,奥美医疗用品股份有限公司,"Allmed Medical Products Co., Ltd",amyl,中小板,20190311
002951.SZ,金时科技,四川,四川金时科技股份有限公司,"Sichuan Jinshi Technology Co.,Ltd",jskj,中小板,20190315
002952.SZ,亚世光电,辽宁,亚世光电(集团)股份有限公司,"Yes Optoelectronics (Group) Co., Ltd.",ysgd,中小板,20190328
002953.SZ,日丰股份,广东,广东日丰电缆股份有限公司,"Guangdong Rifeng Electric Cable Co., Ltd.",rfgf,中小板,20190509
002955.SZ,鸿合科技,北京,鸿合科技股份有限公司,"Hitevision Co., Ltd.",hhkj,中小板,20190523
002956.SZ,西麦食品,广西,桂林西麦食品股份有限公司,"Guilin Seamild Foods Co., Ltd",xmsp,中小板,20190619
002957.SZ,科瑞技术,深圳,深圳科瑞技术股份有限公司,"Shenzhen Colibri Technologies Co.,Ltd.",krjs,中小板,20190726
002958.SZ,青农商行,山东,青岛农村商业银行股份有限公司,Qingdao Rural Commercial Bank Corporation,qnsh,中小板,20190326
002959.SZ,小熊电器,广东,小熊电器股份有限公司,"Bear Electric Appliance Co.,Ltd.",xxdq,中小板,20190823
